{
  "schema_version": 1,
  "audit_date": "2026-07-30",
  "scope": "all current roadmap tasks and all tracked Markdown",
  "tasks": [
    {"ticket":"BUG-CDC-01","local_work_state":"regression_closed","closure_blocker":"none","evidence":["tests/integration/test_memory_depth_pipeline.py"]},
    {"ticket":"QUALITY-01","local_work_state":"regression_closed","closure_blocker":"none","evidence":["qualification/policies/compatibility-baseline-v1.json"]},
    {"ticket":"QUAL-01","local_work_state":"regression_closed","closure_blocker":"none","evidence":["qualification/policies/ga-gates-v1.json"]},
    {"ticket":"RELEASE-01","local_work_state":"completed","closure_blocker":"hosted_or_protected_evidence","evidence":["scripts/release/publication.py","qualification/evidence/release-01-publication-dry-run-v1.json"]},
    {"ticket":"SCALE-02","local_work_state":"regression_closed","closure_blocker":"none","evidence":["qualification/performance/ubuntu24-scale-current-v2.json"]},
    {"ticket":"AI-03","local_work_state":"completed","closure_blocker":"external_tool_evidence","evidence":["src/dv_platform/ai/code_graph.py","tests/ai/test_context_optimization.py"]},
    {"ticket":"DOC-00","local_work_state":"completed","closure_blocker":"none","evidence":["qualification/policies/capability-ledger-v1.json","tests/qualification/test_capability_governance.py"]},
    {"ticket":"DOC-02","local_work_state":"completed","closure_blocker":"none","evidence":["qualification/policies/document-catalog-v1.json","scripts/checks/repository_contracts.py"]},
    {"ticket":"DOC-03","local_work_state":"completed","closure_blocker":"none","evidence":["qualification/policies/document-catalog-v1.json","qualification/policies/progress-ledger-v1.json","tests/repository/test_repository_contracts.py"]},
    {"ticket":"TIER-01","local_work_state":"no_authorized_local_work","closure_blocker":"owner_decision","evidence":["docs/roadmap.md"]},
    {"ticket":"BOARD-01","local_work_state":"no_authorized_local_work","closure_blocker":"owner_decision","evidence":["docs/roadmap.md"]},
    {"ticket":"SEM-01","local_work_state":"completed","closure_blocker":"none","evidence":["qualification/evidence/SEM-01/systemverilog-expression-semantics-v3.json","tests/integration/test_slang_integration.py"]},
    {"ticket":"SEM-02","local_work_state":"no_authorized_local_work","closure_blocker":"external_tool_evidence","evidence":["schemas/rtl/cross-language-bindings-v1.schema.json"]},
    {"ticket":"SEM-03","local_work_state":"completed","closure_blocker":"none","evidence":["qualification/evidence/SEM-03/frontend-matrix-v1.json","tests/qualification/test_external_design_evidence.py"]},
    {"ticket":"FORM-01","local_work_state":"completed","closure_blocker":"none","evidence":["qualification/evidence/FORM-01/formal-evidence-v1.json","tests/integration/test_formal_assumption_pipeline.py"]},
    {"ticket":"CDC-01","local_work_state":"completed","closure_blocker":"none","evidence":["qualification/evidence/CDC-01/cocotb-evidence-v1.json","qualification/evidence/CDC-01/formal-evidence-v1.json","tests/integration/test_cdc_schemes_pipeline.py"]},
    {"ticket":"RDC-01","local_work_state":"no_authorized_local_work","closure_blocker":"licensed_signed_evidence","evidence":["docs/roadmap.md"]},
    {"ticket":"MEM-01","local_work_state":"completed","closure_blocker":"none","evidence":["qualification/evidence/MEM-01/cocotb-evidence-v1.json","qualification/evidence/MEM-01/formal-evidence-v1.json","tests/integration/test_memory_depth_pipeline.py"]},
    {"ticket":"PROTO-01","local_work_state":"completed","closure_blocker":"licensed_signed_evidence","evidence":["qualification/policies/capability-ledger-v1.json","qualification/evidence/PROTO-01/artifact-retention-manifest-v1.json","scripts/qualification/proto01_all_open_evidence.py","tests/verification/test_broad_protocol_good_dut.py"]},
    {"ticket":"PROTO-02","local_work_state":"completed","closure_blocker":"external_tool_evidence","evidence":["src/dv_platform/verification/protocols/profiles.py","tests/verification/test_protocol_transaction_models.py"]},
    {"ticket":"PERIPH-01","local_work_state":"completed","closure_blocker":"external_tool_evidence","evidence":["src/dv_platform/generators/peripherals.py","tests/qualification/test_uart_peripheral_qualification.py","tests/qualification/test_i2c_peripheral_qualification.py","tests/qualification/test_spi_peripheral_qualification.py"]},
    {"ticket":"VHDL-01","local_work_state":"completed","closure_blocker":"none","evidence":["qualification/evidence/PROTO-01/artifact-retention-manifest-v1.json","qualification/evidence/PROTO-01/axi4-1.0/vhdl-evidence-v1.json","tests/qualification/test_broad_protocol_vhdl_qualification.py"]},
    {"ticket":"UVM-01","local_work_state":"completed","closure_blocker":"licensed_signed_evidence","evidence":["src/dv_platform/generators/uvm","tests/qualification/test_uvm_project_qualification.py"]},
    {"ticket":"TOOL-01","local_work_state":"completed","closure_blocker":"licensed_signed_evidence","evidence":["src/dv_platform/enterprise/adapters.py","tests/enterprise/test_enterprise_hardening.py"]},
    {"ticket":"COV-01","local_work_state":"completed","closure_blocker":"external_tool_evidence","evidence":["src/dv_platform/execution/coverage/verilator.py","tests/execution/test_verilator_coverage.py"]},
    {"ticket":"COV-02","local_work_state":"completed","closure_blocker":"external_tool_evidence","evidence":["src/dv_platform/verification/coverage_intent.py","tests/verification/test_coverage_intent.py"]},
    {"ticket":"DOC-01","local_work_state":"completed","closure_blocker":"none","evidence":["src/dv_platform/documentation/indexing.py","tests/documentation/test_docs.py"]},
    {"ticket":"SCALE-01","local_work_state":"completed","closure_blocker":"hosted_or_protected_evidence","evidence":["src/dv_platform/execution/scheduler.py","tests/execution/test_scheduler.py"]},
    {"ticket":"PLAT-01","local_work_state":"completed","closure_blocker":"hosted_or_protected_evidence","evidence":[".github/workflows/ci.yml","docs/operations.md"]},
    {"ticket":"AI-01","local_work_state":"no_authorized_local_work","closure_blocker":"owner_decision","evidence":["docs/roadmap.md"]},
    {"ticket":"AI-02","local_work_state":"no_authorized_local_work","closure_blocker":"owner_decision","evidence":["docs/roadmap.md"]},
    {"ticket":"PHYS-01","local_work_state":"no_authorized_local_work","closure_blocker":"owner_decision","evidence":["docs/roadmap.md"]}
  ]
}
